userName,score,at,content
Masaul K Ahmad,4,2021-02-14 21:25:24,Bagus. Kurang satu fungsi: TOLONG KASIH PENGATURAN MATI OTOMATIS DONG. Makasih
A Fikri,1,2021-02-07 10:39:23,Tidak bisa login
uBzhzbnbsgvsvskgwcsgsgnbrsddjdowzhxhssbvs,5,2021-02-06 18:27:59,"dulu saya pengguna ios trs pindah ke android, tapi blm bisa move on dr apple music:("
Aura Desma cahyani putri,5,2021-02-06 07:14:37,Gk ada lagu 💜𝗕𝗧𝗦⟭⟬💜
Igun Rosie,5,2021-02-04 12:49:47,really really like this apps music ❤️👑
Novita Septiyani,4,2021-02-03 21:14:38,Bagus tapi agak lambat
Magen Tse,4,2021-02-02 12:12:40,Good
Andre Resi,3,2021-02-02 10:21:20,3 z duluny
GAGAL PRO,3,2021-02-01 23:02:27,Di android 11 belom optimal
Kahar s,5,2021-02-01 14:01:27,Good
Dony “A” Nuransyah,1,2021-01-31 12:41:34,the app very slow to load if device not iOS or MacOS 😞
Arma Rama,4,2021-01-30 20:08:05,"Apple musik, memang yang ter baik jg yang paling ok"
Jojok Sembehbalung,5,2021-01-29 23:31:37,Ok
Mas Ruri,3,2021-01-28 00:03:19,Bersemangat
Gerry 24,4,2021-01-25 03:29:19,plis tambahin sleep mode T.T i need that
Wisnu NZXT,4,2021-01-17 00:09:05,"Ok lah ini aplikasi apple masuk ke android. Saya mau memberikan saran 1. Tambahkan fitur sleep mode atau lagu akan mati dengan waktu yang dintetukan 2. rekomendasi music agak kurang menarik aj,nggak bisa nentuin lagu yang lagi mood misal bingung mau cari lagu apa tapi nggak dikasih tau . Cmn itu aj sih yang harus dibenerin terutama bot rekomendasi music nya oh ya tambahin playlist lagu lagu anime overall bagus sih kualitas, ui ,animasi best lah"
Rina Rina,5,2021-01-15 16:30:31,Baru Download
Muhammad Kenedi,1,2021-01-14 11:12:47,Gilo kota saya abis tidak berfungsi pulo apelikasi ini
Adifa,2,2021-01-14 08:33:08,"setelah diupdate jadi sering error. kadang ga bisa ngeplay lagu, kadang pencet lagu apa yang diputar lagu apa, kadang lagu Explicit tiba-tiba ga bisa."
Reni Anggraeni,5,2021-01-12 21:14:33,💜💜💜💜
Heni Purwati,5,2021-01-12 14:47:55,Aku sih suka sama aplikasi ini Cuma Pas mau buka lagunya harus langganan dulu Jadi ngga bisa dengar lagu deh... 😔😢
Vina Pebriani,2,2021-01-12 11:14:44,Cara masuknya gimana yah ?
Gacha XD,4,2021-01-12 09:47:50,suara lagu tidak keluar
Raden Ahmad,4,2021-01-12 06:20:35,ok
Aditya Orenji,4,2021-01-10 19:35:17,better play on my iPad and worst on my android
Mu'zam Arabi,1,2021-01-10 16:52:54,Ribet banget log in doang -__-
Dean Al Kharraz,5,2021-01-09 14:30:46,Bagussss binguttttsssss
Azril Brian Erlangga,4,2021-01-08 09:49:41,Tambahkan pembayaran menggunakan pulsa dong
SHORT VIDIO,1,2021-01-07 06:28:09,Jelek banget app ini!!!!
Wiwik Blitar,5,2021-01-07 05:51:20,Apk ini bagus banget aku sangat suka jadi aku kasih bintang 5 deh. Dan kalian buruan donlow ya pokoknya nyesel deh kalo gak donlow
kanaya angelia,1,2021-01-05 13:50:16,Picek suruh bayar🖕
Najwa Fahrunnisa,1,2021-01-04 10:56:20,"Saya kira aplikasi nya gak berbayar(gratis) trus saya coba download, pas saya buat ID Apple tapi harus berbayar. Yaudah pake di sebelah kaya youtube music ga berbayar 😒"
Travena,1,2021-01-03 12:39:19,Saya tidak suka berlangganan
android HP,5,2020-12-28 20:34:08,yeey bisa juga buat download crazy face yeah!!
Evi S,3,2020-12-28 09:51:09,Kesel bgt kenapa ada lagu yg ga bisa di play. Udah uninstal terus instal lagi ttp ga bisa 😡
wiro warhadi,5,2020-12-20 16:36:48,Great
Brow Dika,5,2020-12-20 05:00:10,Mantapp
Fahris h,5,2020-12-18 14:54:41,Wajar bayar karena setiap lagu ada licensinya cuk licensinya bayar gak gratisan cuk kalau mau gratis diyoutube banyak
Qaulan Syadida,5,2020-12-18 11:23:58,Bayar ya guys ✨
Sayyidatus Sholihah,5,2020-12-17 06:38:08,Suka banget sama am
Markel Maribondang,5,2020-12-16 03:26:54,Love it
Saedinar Alfaridzi,5,2020-12-15 06:16:19,"Saya pengguna baru Apple music, fiturnya bagus, tambahkan lagi fiturnya seperti pada lirik tulisan bahasa korea, Jepang atau semacamnya di tambahkan terjemahan 👌. Bagus tampilannya! Sering perbarui tampilannya ya!"
Saya Aku,5,2020-12-12 23:00:40,Yudi Nopo Moal Mias
Afinariefinnn,5,2020-12-12 04:02:54,Akhirnya bisa share lewat ig story wkwkw makasih apple music gak pilih kasih ternyata sama user Android!
Muhammad Agung,5,2020-12-11 15:27:28,"All originals are here!!! Recommended music app! What you pay, what you get!"
Mirza Hadi,5,2020-12-08 03:43:46,Opsional
subdishar dismat,5,2020-12-06 07:10:36,Keren
Air putih,5,2020-12-03 00:01:46,No caption
Top Silenxe,5,2020-11-30 14:28:37,Gw kesini karena peraturan IOS 14 untuk family sharing :)
Adit Pranaja,5,2020-11-30 10:28:19,Ginini kalau dah punya lagu danyak/lengkap (Aku mencium editor sejati ni) karna googel nya radak lemot² buat download lagu di Mp3 ya sudah Shazam mengirim ku ke sini menurut ku yang lemot hp nya sih kayaknya jadi belum tentu.
Bless Life,5,2020-11-30 07:12:19,Good but pls make more options on playlists
Syamuel Man,5,2020-11-29 21:22:49,Bagus mantap
Yolan Dari,1,2020-11-29 20:29:07,sudah bayar tapi sayangnya tulisanx belum premium. sekelas apple kok nipu. asem
Haruna Yukito,2,2020-11-29 10:42:58,Harus banget bayar dulu ya -_-
fani boy,5,2020-11-28 15:03:28,"mantapp.. nyaman mungkin karena terbiasa. stok lagu lumayan lengkap. ada ost, ada cover. ada original."
Isco Pebrian,5,2020-11-28 02:29:31,Soundnya high quality banget 🥰
Cece ganis,5,2020-11-25 12:59:55,maaf ada yg bisa bantu gak ini pembayaran nya selain kartu kredit bisa gak?
Bos Akujoi,5,2020-11-22 18:36:48,Bagus sekali aku suka suka sekali
GAMPANG POKOKE POKOKE Pokoke,5,2020-11-21 18:45:15,Asalamualaikum wr wb..diALAM Gaib tiada siang maupun malam ..hanya waktu malam dijadikan siang oleh Bangsa Gaib
Dilawati,2,2020-11-20 08:06:02,Tolong sediakan pembayaran melalui pulsa.
Suardi Juanda,3,2020-11-20 00:30:33,Test dulu...semoga sesuai keinginan
Muhammad Rafli,1,2020-11-17 20:55:14,applikasi sekelas dri apple lemotnya minta ampun
YUDIANUS MASARA,5,2020-11-17 12:46:13,good
Roviq Mumin M,5,2020-11-16 21:05:14,I love this app
Jeon Seulgi,3,2020-11-16 15:13:46,"Bagus aja tp kalo tiap download lagu, apk nya terkeluar sendir dan lagu yg td di dengarin langsung mati.."
BAGUS WIDODO,5,2020-11-13 03:46:30,"Streaming music terbaik, kualitas suara yang dihasilkan sangat bening, jernih."
Bacharuddin Iqbal,1,2020-11-12 06:36:52,"Gabisa putar musik, harus berlangganan, bayarnya cuma pake kartu kredit lagi, bagi yg gapunya gimana, dan masih banyak yg gapunya."
Aji Dena,5,2020-11-10 11:45:15,"sudah bisa download Musik Video juga, yg memang sblmnya hanya khusus di iPhone saja🙏🏾"
Papih Oyond,1,2020-11-10 04:24:35,"Download data perlagu nya lemot, masih kalah sama yt music dan spotify memutar music seperti dari sd card tanpa loading."
Himcp Chord Channel,2,2020-11-10 03:29:57,Wajib pakai kartu kredit kayaknya..
Nevan Radeya,4,2020-11-06 18:20:44,Kualitas musiknya sebenarnya bagus cuman kalo loading itu lama jadi bikin ga mood untuk musikan lagi. TAPI musik yg saya cari lebih lengkap di sini dari apk music lain kecuali YT
A.heryadi Adi,3,2020-11-05 19:07:02,"Baru nyobain,,"
Kimil Art,4,2020-11-05 09:53:39,Ok
Sukri Sukri,5,2020-11-02 22:31:24,Full mantap
Busuwardi Mamahebring,4,2020-11-02 08:58:57,Ok
Gerson Jerome,5,2020-11-01 21:57:38,I like this music app
Panji ArtStudio,5,2020-11-01 15:35:08,"Luar biasa, sekarang lagu bisa di share ke instagram story"
Hari Romansyah,5,2020-10-31 07:48:02,"Mantap, ane suka UI nya. Untuk masalah pembayar santai, ane dpet gratisan mulu :v Lebih baik dari app sebelah mslah kualitas."
Theone abhy (abhy),5,2020-10-30 06:26:00,Nice app
Yahya Angga Winata,5,2020-10-29 23:44:10,audio nya mantap Download offline ngga ada pilihan kualitas audio nya Akhirnya sekarang bisa share story ke IG di android yg tadi nya cuma untuk ios Bisa buat gaya dikit lah make apple music
Syahrul 789,5,2020-10-27 14:19:02,Lebih 0k
Super Jhos,4,2020-10-26 15:02:55,ok
アルヨ,5,2020-10-25 20:20:45,Tolong di baca ya ini itu aplikasi streaming BERBAYAR jadi kalo kalian mau yang gratisan download musik aja di google aja jangan download ini aplikasi kalo lu maunya gratisan mulu
Andino_Ape,3,2020-10-25 13:50:37,"Sy pengguna samsung galaxy note 10, utk kualitas suara sy cenderung pilih YT Music, sebenernya di apple music sih dah jernih dgn kualitas AAC, tp di YTM mampu smp dgn kualitas FLAC. Yg bikin sy kecewa adalah dr segi pembayarannya.. knp hrs kudu kartu kredit.?! Apa gag ada cara lain.? Krn gak semua org pegang kartu kredit. Dan memang apple musik termasuk lebih murah dr pada YTM (Rp.59rb/bulan). Wajarlah kl YTMusic mahal, krn YTM banyak pilihan dgn kualitas suara baik dr SBC, AAC, FLAC."
Eduard Simbolon,5,2020-10-23 15:30:24,Amazing
Ephal Rumbia,5,2020-10-23 15:09:43,Keren banget
Denny Kaligis,5,2020-10-23 12:52:55,Mantap
Achmad Firdaus,5,2020-10-22 22:30:13,Pengganti google music play
Curros Waffle,5,2020-10-22 14:59:41,(Bagus) Aku dulu pengguna iphone suka beli music trus aku pindah ke android aku kira music aku terbuang sia sia gara gara pindah ke android tapi enggak ada apple music aku dulu suka beli music di iTunes.
K-POP TV OFFICIAL YouTube Channel,5,2020-10-21 17:49:33,Apk nya keren banget buat dengerin musik yang aku suka..😉😉😉
emuzs,1,2020-10-21 10:01:50,kalau daftarnya harus berlangganan apps nya juga berlangganan dong
Nasrullah Arfa Arief,2,2020-10-20 18:41:08,"suka ngebug, lagi yang udah di download sama udah di simpen di library, sebagian besar hilang"
arief aja,5,2020-10-20 11:59:05,suka sekali aplikasi ini
RUDI GUNAWAN aozora,1,2020-10-16 22:45:41,Bad bad bad bad bad
Pratama Aryaa,5,2020-10-15 23:20:13,Yes Ok
RamSaint,2,2020-10-15 18:26:21,Bayar
ugu widodo,5,2020-10-14 11:45:43,Skrng jd bs nyetel music di andro ama iphone.... Ini aplikasi berbayar sangat rekomen..... Apalagi pke paket pelajar...
Yosef Johanz (Asefjallu),4,2020-10-13 13:01:15,Coba dulu ya 👌😁
Ferry Kurniawan,1,2020-10-11 19:39:36,"Tolong lah dipermudah untuk pembayaran nya ,pakai dana,ovo,gopay atau potong pulsa gitu biar gampang"
Meisy Vanesia,5,2020-10-10 11:26:15,"Saya suka aplikasinya, tapi masih banyak bug kadang suka lelet padahal jaringan gaada masalah Mohon diperbaiki.."
Bayu Gaming,5,2020-10-09 15:55:34,Very good and i like this ❤️
Rahmad Purnomo,5,2020-10-08 21:54:23,"Puas banget pakai Apple Music, lagu-lagunya lengkap."
Alvi Alfharizi,4,2020-10-08 20:01:10,tolong agar lagunya bisa di post di Instagram
hendri ani,1,2020-10-06 13:17:46,Uninstall!!!!! Kirain bakal banyak metode pembayannya. Sangat disayangkan
Sarah Aprilia,1,2020-10-06 13:14:31,"Bukan nggak mau membayar yah. Saya mau bangat membayar, tapi sediakan cara berlangganan yang selain kartu kredit"
Ayu Alisya,1,2020-10-06 13:12:14,"Berbayar tidak masalah. Tapi tolong tambahkan metode pembayaran lain. Ada ovo, gopay, link aja, dana."
Sr Nrsn,1,2020-10-06 13:05:38,"Akan sangat bagus untuk menyediakan cara berlangganan yang lain, seperti penotongan pulsa, dana, ovo gopay dll. Semoga di baca"
Acip Yulianto,5,2020-10-05 13:19:11,godf
Deva Erlangga putra,5,2020-10-03 22:35:37,Ok sip
Arif Siregar,5,2020-10-03 20:56:20,"More Song, Nice Motion while the song is playing"
hilmi pradana,4,2020-10-02 05:37:25,Please developers add to share the music on story in the Ig likes originally in IOS
Fackboy Micin,1,2020-10-01 15:46:23,cuma lagu suruh bayar merugikan sekali
cekson cekson,4,2020-09-29 18:23:21,Mediocre
Thio Meiza,5,2020-09-28 16:45:49,How to set up a sleep time in apple music. Thank you
Tarul Crb,5,2020-09-28 14:47:44,Mantap
Muizzatun Ihsani,1,2020-09-26 00:31:50,"Cara berhenti berlangganannya kek gimana? Bingung, minta tolong dong T_T"
Muhammad Ridwan Dwi Syah Putra,1,2020-09-24 13:26:06,Ini lagu bisa di donlod ngak sih gua cari tempat donlod nya dimana y hmm mungkin ini untuk dengari aja kali y uuuu lagu taik tapi saya kasih bintang 5
Dinda Daffa,5,2020-09-24 13:01:17,Mantap
Ike Melani,1,2020-09-23 14:06:46,Ga enak aplikasinya
Reswara Sigit,1,2020-09-22 23:01:05,Kok saya gabisa log in ya
Pengguna Google,1,2020-09-22 22:25:46,Mohon lebih dioptimalkan untuk ponsel Android. 😭 Worst app
henry dharmawan,3,2020-09-22 20:52:20,"Sudah langganan di iPhone. Tapi sejak saya pindah Android, aplikasinya kurang responsif dan lelet, padahal jaringan bagus. Tolong perbaiki lagi kedepannya"
Pilgrim,5,2020-09-22 00:38:23,"Wahhh mantapp lagu-lagu yang udh gw beli di IPhone ternyata masih ada. Wihhh beruntung banget, tinggal download ulang ajj gak usah beli lagi.... mantappp thanks Apple Music. Satu lagi kalau bisa apple podcast jadiin satu ajj dengan apple music pasti kerennn... 👍👍👍"
Alan Yuliprat,4,2020-09-21 00:48:02,"Saya tambahin bintang nya, karena udah bisa pembayaran lewat DANA. Feedback kedepannya untuk developer aplikasi ini, tingkatin lagi ya optimalisasi aplikasi nya, saya liat untuk optimalisasi software nya masih bagusan si hijau."
Mamak Mamak,2,2020-09-19 18:40:30,Bagus
baduyWRLD,2,2020-09-18 22:49:25,app yang sangat mengecewakan
Resal,5,2020-09-17 22:43:16,Good
Daniel Tumpal Sinurat 089,5,2020-09-15 20:41:04,Aku danglod ini karena mau buka kunci ipone aku
Dim Yikwa,5,2020-09-12 14:11:24,Hp android ngak bisa sambung ke iPhone tuu
Rhandra,3,2020-09-12 13:18:53,"Masih aja lemot pemakaiannya, tidak smooth kayak Spotify"
Retno Sekar Arumi,4,2020-09-12 12:10:54,Aku kasih bintang _4 dlu ya soalnya aku baru donwlod🙏
Hegar Manggala,1,2020-09-10 21:24:09,"Susah cara berlangganannya., hrus punya CC ., tlong lah apple music bisa berlangganan menggunakan potong pulsa atau pembayaran melalui DANA, GOPAY ATAU OVO., saya gx masalah kalo harus bayar biaya berlangganan asal utk pembayarannya dipermudah., jgn harus menggunakan kartu kredit"
Abdul Bari,5,2020-09-07 18:34:07,Great amazing
Benny,5,2020-09-07 18:14:58,"Next update, semoga sudah bisa share ke IG Story."
Jeje Bana,1,2020-09-04 15:46:42,Cuman bisa di iPhone doang
Athaya Rafif Arrayyan A.R.A.R,5,2020-09-04 14:01:48,Muantepu jewaaa
Cak Memet,5,2020-09-02 22:54:58,Mantap keren banget hebat terbaik
Yehezkiel Asmin,4,2020-09-01 11:45:11,Tidak sewah di iPhone
Jozsef Mezei,4,2020-08-30 03:23:55,Szia
Nabila Saja,5,2020-08-29 01:26:28,semoga apple ini bisa membuat saya menjadi senang dimana pun dan sampe kapan pun nnt nya
David,5,2020-08-28 23:28:45,"Suka aplikasi nya Bagus streaming music dari hp android maupun iPhone, tapi sayang pembayaran langganan via Dana tidak ada Semoga ada perbaikan fitur seperti aplikasi Spotify,Joox,Resso bisa bikin lirik dengan background"
Budila Rahman,5,2020-08-28 11:50:14,👍
Lucky Ferdi Yanda,5,2020-08-27 20:40:27,"Gak taunya,apl bayar ini klo untuk dngar lagu"
Porenjes Merah,5,2020-08-27 19:04:34,Sangat suka sekali
Eilhan Chariz,5,2020-08-27 14:48:21,Best Music
Yamada Prasetyo,5,2020-08-26 16:00:24,Bu v ..
Efraim Reynaldi Abdas,5,2020-08-25 03:22:09,"Untuk keseluruhan nya smua bagus, tunggu fitur share ke Instagram lagi ya itu aj kurang. mohon untuk di update:)"
Rudi Sumardi,5,2020-08-24 09:07:23,Bagus
Ika Purwantika,5,2020-08-23 17:23:58,Wow kaya ios
Said Fauzul,5,2020-08-22 10:51:20,Suka sekali kualitas audionya sangat detail. Good job apple!!!
Octa Wahyuningtyas,4,2020-08-22 09:39:42,Kenapa metode pembayarannya gabisa pakai dana ya?
Ɗєωα • νвяи_,5,2020-08-20 02:18:31,"Dᴏɴ'ᴛ ʙᴇ ᴀ Nᴇᴛɪᴢᴇɴ, Kᴇᴇᴘ ʙᴇɪɴɢ ᴀ Cɪᴛɪᴢᴇɴ👍🏼👍🏼"
Reva Azdanan,5,2020-08-19 12:10:36,Ini baru impian gua
Kaila Bengkulu,5,2020-08-16 10:39:26,Ini bagus 👍
Mece Wuarlela,5,2020-08-15 11:13:40,bagus soalnya bisa cari lagu di sini
MUHAMMAD FAKHRI DWI NUGROHO,1,2020-08-14 10:17:47,free tapi iklan gpp yang penting ga bayar
Desmiati Bija,4,2020-08-12 11:52:00,Iphone bagus cuma metode pembayaran seharusnya mengikuti metode pembayaran google play yaitu pembayaran pulsa atau pembayaran saldo apple.
ilham habib azizi,1,2020-08-08 22:50:12,too slow
Ismail Sholeh,1,2020-08-08 11:17:21,Aplikasi nya bayar
Ardiansah,5,2020-08-07 18:55:38,Ok
Robin Candra,5,2020-08-05 01:32:22,Ok
Asifa 2611,5,2020-08-01 02:27:28,Baik
Yeni Silvani Dameris S,3,2020-07-30 23:53:49,"Mau kasih saran, kalo boleh yang pengguna android bisa juga ngeshare lagu ke instagram story. Terima kasih 🙏🏻"
ichwan “abit” husaini,1,2020-07-30 11:53:51,Tidak bisa sinkron dengan IPhone
pippa boo,5,2020-07-27 17:52:17,"lihatlah ulasan dari pengguna lain sebelum men-download app ini bagi kalian yang masih enggan bayar buat denger music mending ga usah download app ini, cari app lain yang bikin kalian nyaman, dan bagi kalian yang mengutamakan kualitas tanpa peduli harus keluarin biaya app ini cocok buat kalian"
Vie Wi,5,2020-07-23 19:28:22,Sebelumnya saya pemakai Iphone selama ±3 tahun dan saya banyak membeli Album dan masing² lagu. Kemudian. tahun kemarin saya ganti android. Tapi kalo di buka dari android pakai akun itunes kok album dan lagu² yang saya beli kok kosong ya? Apa hanya di Ios saja?
Gerson Jerome,5,2020-07-23 18:40:52,"Good good very goooood, i love this app...."
Mang Ody,1,2020-07-22 22:29:31,Kurang optimal
fikrul islam,5,2020-07-22 22:24:55,Kualitas jernih
Ibnu Abdillah Ridho,5,2020-07-18 21:36:12,Miskin bilang bos
Gede Puja Astika,5,2020-07-18 03:13:14,"Teman saya banyak bilang kalau aplikasi ini adalah aplikasi musik online dengan kualitas suara terbaik dan lagunya kedua terbanyak setelah spotify. Karena saya mencari kualitas suara, apalagi saya biasa dengar musik di iphone & ipod, aplikasi ini jadi pilihan saya di samping aplikasi musik online lainnya misal qobuz atau tidal"
Syammy Yusuf,5,2020-07-17 19:44:48,"Meskipun playlistnya nggak sebanyak dan selengkap spotify, tapi tetep aja kualitas musiknya kaga bisa boong. 👍🏻👍🏻👍🏻"
Jati L,5,2020-07-16 19:12:08,"Buat kamu yg ngeluh kenapa musik berbayar. Ini karena original dan bentuk apresiasi terhadap para pelaku industri musik. Gratis ada banyak arti. Gratis karena udah ada iklan, versi trial, atau benar2 free. Satu lagi, sebenarnya gak mahal, mungkin emang bukan Anda target pasarnya"
Ardi Sanjaya,5,2020-07-14 10:05:37,Kwalitas sound jernih dan nyaman didengar sambil santai. Atau bekerja pokoknya asyiiik
Ibu Mamah,5,2020-07-14 01:36:03,Saya seuring deungeurin musik klw malam tapi suara nya tida seubeuning di apple music
Salomo Yoel Lianggada,5,2020-07-13 06:37:07,kualitas audio dapet bgt .. bahkan lbh jelas daripada tidal
samudera arie,5,2020-07-12 13:29:28,Mantappp
Fathin Qanita,2,2020-07-11 12:43:57,We all know Apple music is a paid subscription which is a big deal for me as an avid music listener. I know Apple music content is one of the best among other streaming services so I really don't mind with a cost of monthly subscriptions that follow. But it's really disheartening to know that the app contain so much bugs that I cannot play radio at all and it takes a lot of time to play just one song. I have to say this is a major disappointment from user experience. 👎
Hartias Ningrum,4,2020-07-10 10:38:16,mantul
Rully Pahruroji,5,2020-07-10 06:38:36,The best 👌
Belader ependi Lupa sama muka,4,2020-07-09 08:01:31,Mantap
Carmin Casmadi,4,2020-07-07 21:32:52,Saya suka..saya suka
Deky Permana,5,2020-07-07 05:01:36,"Dear Apple, This App Is So Good But You Need To Add Some Option To Pay A Premium Account For Example Google Pay Or Paypal. Just That What I Want to Tell, Thanks Apple!."
Wahab Zaid,5,2020-07-05 00:30:51,Tes ach
Akun Game Buriq,5,2020-07-04 14:28:57,Mantap kayak eek
Cakra Wirawan,5,2020-07-03 21:30:34,"Lebih suka di apple music dibanding streaming music lainnya, harga juga gak jauh beda sama yang lain."
Inno Drive,1,2020-07-03 01:10:22,Haha
Yutip Firtanto,5,2020-07-02 15:07:52,Makasih bisa dengerin lagu sedunia
jane chrsta,2,2020-07-01 19:06:24,Macet macet
Ali Sadikin,5,2020-07-01 17:53:25,Bismillah
hey you,5,2020-07-01 17:27:48,The best
Muttaqin Khoirul,4,2020-06-30 17:44:32,"Setelah update yang terbaru, tiap mau masuk ke aplikasi mesti mulai awal lagi, loading me-restore data lagi, Padahal yang sebelum nya enggak."
Fcnr 004,1,2020-06-29 21:54:16,DIPERUNTUKAN HANYA UNTUK SULTAN😌✊🏻
Ming Wiyono,1,2020-06-29 10:20:44,TIDAK BISA DIBUKA BUATMU BINTANG FULL SATU APPLE
Mu'arif Akhmad,1,2020-06-27 19:51:01,"Jernih lah, bagus lah, tapi bayar, buat yg berduit doang, coba lah free kaya yg lain"
Ade Muhammad,5,2020-06-26 14:19:29,Gue juga pasti$
Naufaldie Monterie,4,2020-06-24 12:09:53,"So far so good, wish the new update we can share the music on instagram stories"
taufik akbar,5,2020-06-24 07:08:40,"Paling the best diantara semua streaming musik seperti spotify,joox dan youtube music,,,,kualitas audio streaming nya diatas semua nya,,,pokoke the best lah,,,bisa dipake di android juga"
Anugrah,4,2020-06-24 00:08:15,Mohon untuk perbaiki bug refresh library yang menjengkelkan:)
Aqela sukri,5,2020-06-23 18:36:00,Ini apk byr
akif ach,5,2020-06-21 05:31:33,😁😁😁😁😁😁
jEmi Efendi,5,2020-06-20 16:45:09,✅✅✅✅✅
ihsan,3,2020-06-18 22:18:50,Tolong segera sediakan fitur sgare lagu di ig story untuk android seperti iphone! Kita sama2 bayar tapi fitur yang diberikan berbeda
Jan Kees Sawen,4,2020-06-16 02:10:50,Aplikasih ini sangatlah membantu
anggy putri Aprillia,5,2020-06-15 09:59:51,Ka tolong gmn loginya aku udh masukin akun email aku eh kok gabisa kak?
Eky Melano,1,2020-06-14 16:44:25,Pgn dengerin dr selain apple gak bisa.. Payah
Neng Fahira,3,2020-06-14 10:15:41,Good
Andri Baghaskara,5,2020-06-10 22:23:47,Aplikasi yang super nyaman buat dengerin musik. Ada music video resmi dari artisnya juga. Juga bisa sambil baca lirik pas dengerin musik. Jadi nggak perlu buka browser atau install 3rd party app lagi. Terbaik pokoknya dibanding aplikasi yang lain...
Hartono Lc,1,2020-06-09 12:25:31,Pake pulsa data gak bukanya?
Muhammad Syawal,4,2020-06-09 12:17:34,Toling diupdate biar bisa share ke instagram stories
Without Walls (Takiyo),5,2020-06-06 19:55:42,"great app. im using apple music on my mac, now i can play it on my android"
Christ N,1,2020-06-06 12:28:19,Kudet dangdut songs
Sukamto Saja,1,2020-06-05 09:00:49,He Guys! aku mau tanya pemutar musik gak bisa apa?mutar yg ada di memori telepon Kok gak ada satupun yg muncul di aplikasi ini....
Aulia Qurrotu Ayuni,1,2020-06-05 04:11:43,"Susah bngt mau sign up. Udah berkali-kali nyoba, ngulangi step nya satu per satu. Tetep aja ga bisa dipake"
Romansyah prtama jekky jekky,5,2020-06-04 02:08:30,Saya kurang mengerti ini diguna kan untuk ap
Zaskia Zaskia,5,2020-06-02 22:56:18,Ya allah beri aku kekuatan untuk menghadapi aplikasi ini sudah 50:download lagu gak ada yg benar
Tri Sasotyo Adi,5,2020-06-01 12:28:05,Bagus
bilqisszhrts sitaa,4,2020-05-31 21:32:05,Baru download ❤🥰
Alwi Jaya,5,2020-05-31 11:33:46,Alwjaya
Zinda Lana,5,2020-05-31 10:16:33,Daftarnya tanpa ID iPhone bisa gak
Leo Hady,5,2020-05-31 01:33:18,Good and the best
Rizke Latisha,5,2020-05-29 13:03:13,Sumpah kaya iphone beneran.....Tapi kalau mau download lagunya lama ya tolong bantu jawab
Supardi Kardi,5,2020-05-26 21:45:43,Mantap
Dika Wahyu (Dika Dikk),5,2020-05-26 17:13:32,"Streaming terbaik yang pernah ada, tapi lagunya tidak sebanyak app ijo"
Sutris No,5,2020-05-25 23:38:52,Mantul
Muhammad Daffa Adsya Alfawazi,3,2020-05-25 13:18:08,"Apple music,why Remixed music isn't there? And why the songs were still lacking, when I searched for it, I couldn't find it? Please add another song, I'm not satisfied"
Choirunnisya,3,2020-05-23 07:11:16,Setiap mau create Apple ID error mulu :(
Zine Coboy sr,5,2020-05-22 22:31:07,Mantap
Iqbal,3,2020-05-22 17:00:29,Please add feature share song to Instagram story
Mixtape1992,5,2020-05-21 14:21:56,Ga masalah berbayar yg penting suara jernih banget..
irawan muhammad,4,2020-05-20 06:14:49,lagu kurang lengkap
Arif f,1,2020-05-20 01:48:27,"Tdk ada pembayaran lewat dana atau metode lain bwt android, pilihan nya hanya kartu kredit!. Ok UNINSTAL"
Ervan Ipank17,5,2020-05-17 18:44:27,Ok
Togar Gultom,5,2020-05-17 16:22:03,Kosong
Muh Hindarsin Ndarsin,1,2020-05-16 20:08:57,"Baru mencoba ,top banget"
Jundhan Wimbadi,5,2020-05-16 04:47:56,"Sdh bisa dimanfaatkan sebaik-baiknya/semakruf-makrufnya dsb dst, Allaahu Akbar, Alkhamdulillaah, Subkhaanallaah, LAA ILAAHA ILLALLAAH, Saya Wim Jundhan Wimbadi Nur Al Amin Salaamullaah, Allaahu Akbar, Amantu Billaah."
Salam Pepito,5,2020-05-15 11:00:15,Mantap
yana teriningsi,5,2020-05-15 03:50:05,FO Yu
Atan Tatung,5,2020-05-15 01:14:43,Good
Billy K. N.,5,2020-05-13 01:48:38,Aplikasinya bagus... Ga lemot kok hehe... Langganan lewat iPhone jadi bisa bayar pake Dana... Dan bisa dengerin Apple Music lewat Android dan iPhone nih sekarang... Top dah...
Badot Dontot,5,2020-05-11 11:17:49,Ok
djulie hanto,5,2020-05-11 09:39:25,Jos pak
Jati Trilaksana,5,2020-05-08 19:44:50,Keren
Fawzul Lismani,5,2020-05-06 19:30:45,"pengalaman bermusik yang kaya, gak rugi berlangganan"
Little RosEta,3,2020-05-06 10:45:02,"I want to let you know ... if sometimes my Apple music has an error ... the signal suddenly becomes ugly when I open this application, even though the other applications don't ... And also I download one album from a musician and the album cover is only half visible ... while the others are OK It's fine even though I didn't download 1 album ... please fix mine ... thank you ..."
Fardo oktario,5,2020-05-05 13:04:02,Mntap
ADE ROSHAN,5,2020-05-04 21:08:21,Mantap banget
Sunta,5,2020-05-03 08:10:06,Sangat bagus
Muhammad Ichsan,5,2020-05-03 03:10:53,"pada ngincer gratis 3 bulanya duluan, semua lagu disini itu ada lisensi nya jadi gak bakal bisa play selain di apple music, knp bayar ya pikir lah tong emang musisi ngeluarin lagu gak pake duit apa ?"
fajriani ani,1,2020-05-02 13:25:46,Aku mau donlot apple music
Soultan Muhammad Albar,5,2020-05-01 22:48:34,Asikkk
Muhamad Ibnu M.,1,2020-05-01 19:12:49,I can't download my playlist even though i have subscription
il3000y,5,2020-05-01 10:05:38,HARUS BANGET YA BERLANGGANAN KALAU MAU DENGER MUSIK OFFLINE AJA
Muhammad Jaksal123,5,2020-05-01 07:14:11,Ingin mendengar musik untuk hilngan rasa letih dlm kina kerja kita
ARUKA,5,2020-04-30 19:46:44,Sangat bagus
스카이 Rzn,5,2020-04-30 17:28:27,Uwaw
